{
  "dishId": "dau-phu-sot-ca-chua",
  "model": "claude-opus-5-5",
  "draftedAt": "2026-10-19",
  "validation": "valid",
  "stopReason": "end_turn",
  "problems": [],
  "missingIngredients": [],
  "usage": {
    "inputTokens": 93,
    "outputTokens": 1066,
    "cacheCreationInputTokens": 0,
    "cacheReadInputTokens": 4515
  }
}
